{
  "schema_version": "1.0",
  "skill_id": "bid-format-extraction",
  "project_id": "SIM-WB-20261011",
  "artifact_id": "ART-06-FORMAT-EXTRACTION",
  "revision": 1,
  "created_at": "2026-10-10T23:15:21.925232+00:00",
  "status": "needs_review",
  "inputs": [
    {
      "artifact_id": "ART-01-NATIVE",
      "revision": 1,
      "relative_path": "artifacts/01-source-intake.json",
      "sha256": "e54a67dd19063b1f9e1345fa55cad3525f62891b1fc03b5645dc644b7852f464"
    },
    {
      "artifact_id": "ART-02-TENDER-ROUTING",
      "revision": 1,
      "relative_path": "artifacts/02-tender-routing.json",
      "sha256": "43009f353aa6b48ab2b7b9f5c59a5fe95257e82d2c09310f65dcba066adada67"
    }
  ],
  "summary": "提取强制格式：六部分投标文件组成、技术服务方案 4.1/4.2/4.3 二级结构与投标函签署盖章要求，均登记为 mandatory/fixed。",
  "data": {
    "formats": [
      {
        "id": "FMT-1",
        "kind": "toc",
        "strength": "mandatory",
        "title": "投标文件强制组成与目录",
        "original_text": "必须包括：1投标函、2报价表、3资格证明、4技术服务方案、5逐项响应表、6业绩附件。4.1事件闭环管理、4.2集成与验收、4.3服务保障。",
        "change_policy": "fixed",
        "template_path": null,
        "sources": [
          {
            "source_id": "SRC-001",
            "revision": 1,
            "sha256": "06e94c48e988157848908ff2e209df8f74a0b38c52cc60fd0331eaa3ff1018b8",
            "location": "body[21]/paragraph",
            "quote": "必须包括：1投标函、2报价表、3资格证明、4技术服务方案、5逐项响应表、6业绩附件。4.1事件闭环管理、4.2集成与验收、4.3服务保障。",
            "kind": "tender"
          }
        ]
      },
      {
        "id": "FMT-2",
        "kind": "form",
        "strength": "mandatory",
        "title": "投标函",
        "original_text": "必须包括：1投标函、2报价表、3资格证明、4技术服务方案、5逐项响应表、6业绩附件。",
        "change_policy": "fixed",
        "template_path": null,
        "sources": [
          {
            "source_id": "SRC-001",
            "revision": 1,
            "sha256": "06e94c48e988157848908ff2e209df8f74a0b38c52cc60fd0331eaa3ff1018b8",
            "location": "body[21]/paragraph",
            "quote": "必须包括：1投标函、2报价表、3资格证明、4技术服务方案、5逐项响应表、6业绩附件。",
            "kind": "tender"
          }
        ]
      },
      {
        "id": "FMT-3",
        "kind": "form",
        "strength": "mandatory",
        "title": "报价表",
        "original_text": "必须包括：1投标函、2报价表、3资格证明、4技术服务方案、5逐项响应表、6业绩附件。",
        "change_policy": "fixed",
        "template_path": null,
        "sources": [
          {
            "source_id": "SRC-001",
            "revision": 1,
            "sha256": "06e94c48e988157848908ff2e209df8f74a0b38c52cc60fd0331eaa3ff1018b8",
            "location": "body[21]/paragraph",
            "quote": "必须包括：1投标函、2报价表、3资格证明、4技术服务方案、5逐项响应表、6业绩附件。",
            "kind": "tender"
          }
        ]
      },
      {
        "id": "FMT-4",
        "kind": "attachment",
        "strength": "mandatory",
        "title": "资格证明",
        "original_text": "必须包括：1投标函、2报价表、3资格证明、4技术服务方案、5逐项响应表、6业绩附件。",
        "change_policy": "fixed",
        "template_path": null,
        "sources": [
          {
            "source_id": "SRC-001",
            "revision": 1,
            "sha256": "06e94c48e988157848908ff2e209df8f74a0b38c52cc60fd0331eaa3ff1018b8",
            "location": "body[21]/paragraph",
            "quote": "必须包括：1投标函、2报价表、3资格证明、4技术服务方案、5逐项响应表、6业绩附件。",
            "kind": "tender"
          }
        ]
      },
      {
        "id": "FMT-5",
        "kind": "layout",
        "strength": "mandatory",
        "title": "技术服务方案（含4.1/4.2/4.3）",
        "original_text": "必须包括：1投标函、2报价表、3资格证明、4技术服务方案、5逐项响应表、6业绩附件。4.1事件闭环管理、4.2集成与验收、4.3服务保障。",
        "change_policy": "fixed",
        "template_path": null,
        "sources": [
          {
            "source_id": "SRC-001",
            "revision": 1,
            "sha256": "06e94c48e988157848908ff2e209df8f74a0b38c52cc60fd0331eaa3ff1018b8",
            "location": "body[21]/paragraph",
            "quote": "必须包括：1投标函、2报价表、3资格证明、4技术服务方案、5逐项响应表、6业绩附件。4.1事件闭环管理、4.2集成与验收、4.3服务保障。",
            "kind": "tender"
          }
        ]
      },
      {
        "id": "FMT-6",
        "kind": "form",
        "strength": "mandatory",
        "title": "逐项响应表",
        "original_text": "必须包括：1投标函、2报价表、3资格证明、4技术服务方案、5逐项响应表、6业绩附件。",
        "change_policy": "fixed",
        "template_path": null,
        "sources": [
          {
            "source_id": "SRC-001",
            "revision": 1,
            "sha256": "06e94c48e988157848908ff2e209df8f74a0b38c52cc60fd0331eaa3ff1018b8",
            "location": "body[21]/paragraph",
            "quote": "必须包括：1投标函、2报价表、3资格证明、4技术服务方案、5逐项响应表、6业绩附件。",
            "kind": "tender"
          }
        ]
      },
      {
        "id": "FMT-7",
        "kind": "attachment",
        "strength": "mandatory",
        "title": "业绩附件",
        "original_text": "必须包括：1投标函、2报价表、3资格证明、4技术服务方案、5逐项响应表、6业绩附件。",
        "change_policy": "fixed",
        "template_path": null,
        "sources": [
          {
            "source_id": "SRC-001",
            "revision": 1,
            "sha256": "06e94c48e988157848908ff2e209df8f74a0b38c52cc60fd0331eaa3ff1018b8",
            "location": "body[21]/paragraph",
            "quote": "必须包括：1投标函、2报价表、3资格证明、4技术服务方案、5逐项响应表、6业绩附件。",
            "kind": "tender"
          }
        ]
      },
      {
        "id": "FMT-8",
        "kind": "signature",
        "strength": "mandatory",
        "title": "投标函签署及盖章",
        "original_text": "Q2投标函须有签署及盖章；缺失则否决",
        "change_policy": "fixed",
        "template_path": null,
        "sources": [
          {
            "source_id": "SRC-001",
            "revision": 1,
            "sha256": "06e94c48e988157848908ff2e209df8f74a0b38c52cc60fd0331eaa3ff1018b8",
            "location": "body[19]/paragraph",
            "quote": "Q2投标函须有签署及盖章；缺失则否决",
            "kind": "tender"
          }
        ]
      }
    ],
    "unknowns": [
      "原文未提供投标函、报价表、逐项响应表的具体表样或模板文件，template_path 保持 null。",
      "原文未规定页码、装订、份数及正副本要求。"
    ]
  },
  "warnings": [
    "原文未附模板文件，格式只能按原文标题拟制，不能声称已有官方表样。"
  ],
  "blockers": []
}
